{
  "name": "hve-core",
  "metadata": {
    "description": "HVE Core",
    "version": "3.3.105",
    "pluginRoot": "./plugins"
  },
  "owner": {
    "name": "Microsoft"
  },
  "plugins": [
    {
      "name": "ado",
      "source": {
        "source": "github",
        "repo": "microsoft/hve-core",
        "path": "plugins/ado",
        "ref": "plugins-v3.3.105"
      },
      "description": "Azure DevOps work item management, build monitoring, and pull request creation",
      "version": "3.3.105",
      "author": {
        "name": "Microsoft",
        "url": "https://www.microsoft.com"
      },
      "homepage": "https://github.com/microsoft/hve-core",
      "repository": "https://github.com/microsoft/hve-core",
      "license": "MIT",
      "keywords": [
        "azure-devops",
        "ado",
        "work-items",
        "builds",
        "pull-requests"
      ],
      "agents": [
        "agents/ado/ado-backlog-manager.md",
        "agents/ado/ado-prd-to-wit.md",
        "agents/hve-core/subagents/rpi-planner.md",
        "agents/hve-core/subagents/rpi-researcher.md"
      ],
      "commands": [
        "commands/ado/ado-add-work-item.md",
        "commands/ado/ado-create-pull-request.md",
        "commands/ado/ado-discover-work-items.md",
        "commands/ado/ado-get-build-info.md",
        "commands/ado/ado-get-my-work-items.md",
        "commands/ado/ado-process-my-work-items-for-task-planning.md",
        "commands/ado/ado-sprint-plan.md",
        "commands/ado/ado-triage-work-items.md",
        "commands/ado/ado-update-wit-items.md"
      ],
      "rules": [
        "rules/ado/ado-backlog-sprint.instructions.md",
        "rules/ado/ado-backlog-triage.instructions.md",
        "rules/ado/ado-create-pull-request.instructions.md",
        "rules/ado/ado-get-build-info.instructions.md",
        "rules/ado/ado-interaction-templates.instructions.md",
        "rules/ado/ado-update-wit-items.instructions.md",
        "rules/ado/ado-wit-discovery.instructions.md",
        "rules/ado/ado-wit-planning.instructions.md",
        "rules/shared/hve-core-location.instructions.md"
      ],
      "skills": [
        "skills/rpi/rpi-plan",
        "skills/rpi/rpi-plan-critique",
        "skills/rpi/rpi-research",
        "skills/shared/pr-reference"
      ],
      "x-hve": {
        "documentation": "docs/plugins/ado.md"
      }
    },
    {
      "name": "coding-standards",
      "source": {
        "source": "github",
        "repo": "microsoft/hve-core",
        "path": "plugins/coding-standards",
        "ref": "plugins-v3.3.105"
      },
      "description": "Language-specific coding instructions and pre-PR code review agents for bash, Bicep, C#, PowerShell, Python, Rust, and Terraform projects",
      "version": "3.3.105",
      "author": {
        "name": "Microsoft",
        "url": "https://www.microsoft.com"
      },
      "homepage": "https://github.com/microsoft/hve-core",
      "repository": "https://github.com/microsoft/hve-core",
      "license": "MIT",
      "keywords": [
        "coding-standards",
        "code-review",
        "pull-request",
        "quality",
        "bash",
        "bicep",
        "csharp",
        "powershell",
        "python",
        "rust",
        "terraform",
        "uv"
      ],
      "agents": [
        "agents/accessibility/accessibility-reviewer.md",
        "agents/accessibility/subagents/accessibility-framework-assessor.md",
        "agents/accessibility/subagents/accessibility-surface-inventory.md",
        "agents/coding-standards/code-review.md",
        "agents/coding-standards/subagents/code-review-accessibility.md",
        "agents/coding-standards/subagents/code-review-explainer.md",
        "agents/coding-standards/subagents/code-review-functional.md",
        "agents/coding-standards/subagents/code-review-pr.md",
        "agents/coding-standards/subagents/code-review-readiness.md",
        "agents/coding-standards/subagents/code-review-security.md",
        "agents/coding-standards/subagents/code-review-standards.md",
        "agents/coding-standards/subagents/code-review-walkback.md",
        "agents/hve-core/subagents/rpi-researcher.md"
      ],
      "rules": [
        "rules/coding-standards/bash/bash.instructions.md",
        "rules/coding-standards/bicep/bicep.instructions.md",
        "rules/coding-standards/code-review/diff-computation.instructions.md",
        "rules/coding-standards/code-review/review-artifacts.instructions.md",
        "rules/coding-standards/csharp/csharp-tests.instructions.md",
        "rules/coding-standards/csharp/csharp.instructions.md",
        "rules/coding-standards/powershell/pester.instructions.md",
        "rules/coding-standards/powershell/powershell.instructions.md",
        "rules/coding-standards/python-script.instructions.md",
        "rules/coding-standards/python-tests.instructions.md",
        "rules/coding-standards/rust/rust-tests.instructions.md",
        "rules/coding-standards/rust/rust.instructions.md",
        "rules/coding-standards/terraform/terraform.instructions.md",
        "rules/coding-standards/uv-projects.instructions.md",
        "rules/shared/hve-core-location.instructions.md",
        "rules/shared/telemetry-overlay.instructions.md"
      ],
      "skills": [
        "skills/coding-standards/code-review",
        "skills/coding-standards/python-foundational",
        "skills/rpi/rpi-research",
        "skills/shared/pr-reference",
        "skills/shared/telemetry-foundations"
      ],
      "x-hve": {
        "componentMaturity": {
          "agents/accessibility/accessibility-reviewer.md": "experimental",
          "agents/accessibility/subagents/accessibility-framework-assessor.md": "experimental",
          "agents/accessibility/subagents/accessibility-surface-inventory.md": "experimental",
          "agents/coding-standards/code-review.md": "experimental",
          "agents/coding-standards/subagents/code-review-accessibility.md": "experimental",
          "agents/coding-standards/subagents/code-review-explainer.md": "experimental",
          "agents/coding-standards/subagents/code-review-functional.md": "experimental",
          "agents/coding-standards/subagents/code-review-pr.md": "experimental",
          "agents/coding-standards/subagents/code-review-readiness.md": "experimental",
          "agents/coding-standards/subagents/code-review-security.md": "experimental",
          "agents/coding-standards/subagents/code-review-standards.md": "experimental",
          "agents/coding-standards/subagents/code-review-walkback.md": "experimental",
          "rules/coding-standards/code-review/diff-computation.instructions.md": "experimental",
          "rules/coding-standards/code-review/review-artifacts.instructions.md": "experimental",
          "skills/coding-standards/code-review": "experimental",
          "skills/coding-standards/python-foundational": "experimental"
        },
        "documentation": "docs/plugins/coding-standards.md"
      }
    },
    {
      "name": "data-science",
      "source": {
        "source": "github",
        "repo": "microsoft/hve-core",
        "path": "plugins/data-science",
        "ref": "plugins-v3.3.105"
      },
      "description": "Evaluation dataset creation, data specification generation, Jupyter notebooks, and Streamlit dashboards",
      "version": "3.3.105",
      "author": {
        "name": "Microsoft",
        "url": "https://www.microsoft.com"
      },
      "homepage": "https://github.com/microsoft/hve-core",
      "repository": "https://github.com/microsoft/hve-core",
      "license": "MIT",
      "keywords": [
        "data",
        "jupyter",
        "streamlit",
        "dashboards",
        "visualization",
        "data-science",
        "rai",
        "responsible-ai"
      ],
      "agents": [
        "agents/data-science/eval-dataset-creator.md",
        "agents/data-science/gen-data-spec.md",
        "agents/data-science/gen-jupyter-notebook.md",
        "agents/data-science/gen-streamlit-dashboard.md",
        "agents/data-science/test-streamlit-dashboard.md",
        "agents/hve-core/subagents/rpi-researcher.md",
        "agents/rai-planning/rai-planner.md"
      ],
      "commands": [
        "commands/data-science/synth-data-generate.md",
        "commands/rai-planning/rai-capture.md",
        "commands/rai-planning/rai-plan-from-prd.md",
        "commands/rai-planning/rai-plan-from-security-plan.md"
      ],
      "rules": [
        "rules/coding-standards/python-script.instructions.md",
        "rules/coding-standards/uv-projects.instructions.md",
        "rules/rai-planning/rai-identity.instructions.md",
        "rules/rai-planning/rai-license-posture.instructions.md",
        "rules/shared/hve-core-location.instructions.md",
        "rules/shared/untrusted-content-boundary.instructions.md"
      ],
      "skills": [
        "skills/project-planning/rai-planner",
        "skills/rai/rai-standards",
        "skills/rpi/rpi-research"
      ],
      "x-hve": {
        "componentMaturity": {
          "agents/rai-planning/rai-planner.md": "experimental",
          "commands/data-science/synth-data-generate.md": "experimental",
          "commands/rai-planning/rai-capture.md": "experimental",
          "commands/rai-planning/rai-plan-from-prd.md": "experimental",
          "commands/rai-planning/rai-plan-from-security-plan.md": "experimental",
          "rules/rai-planning/rai-identity.instructions.md": "experimental",
          "rules/rai-planning/rai-license-posture.instructions.md": "experimental",
          "skills/project-planning/rai-planner": "experimental",
          "skills/rai/rai-standards": "experimental"
        },
        "documentation": "docs/plugins/data-science.md"
      }
    },
    {
      "name": "design-thinking",
      "source": {
        "source": "github",
        "repo": "microsoft/hve-core",
        "path": "plugins/design-thinking",
        "ref": "plugins-v3.3.105"
      },